{
  "schema_version": "esg-upload/2.0.0",
  "pipeline": "source-typed-v2",
  "document_count": 3,
  "documents": [
    {
      "document_index": 0,
      "filename": "SYNTHETIC_financial_statements_2025.pdf",
      "capture_status": "completed",
      "coverage": {
        "total_pages": 1,
        "counts": {
          "processed": 1
        },
        "pages": [
          {
            "pdf_page": 1,
            "status": "processed",
            "attempts": 1
          }
        ]
      },
      "output": {
        "schema_version": "esg-financial-candidates/2.3.0",
        "parser_version": 6,
        "source_capture_sha256": "e1e28d30da32a6a50c095ca283ccdff325f6fb3fd71edb5036edac9fc09910ea",
        "created_at": "2026-10-22T15:46:56.773324+00:00",
        "number_format": "auto",
        "graph_ready": false,
        "semantic_status": "partial",
        "source_capture_coverage": {
          "total_pages": 1,
          "counts": {
            "processed": 1
          },
          "pages": [
            {
              "pdf_page": 1,
              "status": "processed",
              "attempts": 1
            }
          ]
        },
        "reports": [
          {
            "report_version_id": "report_fe772064cb167fc5676aa1668baaf89d430c395be6255493ce7484d15f0faf12",
            "source_filename": "SYNTHETIC_financial_statements_2025.pdf",
            "source_sha256": "fe772064cb167fc5676aa1668baaf89d430c395be6255493ce7484d15f0faf12",
            "source_access": "source.pdf",
            "company_id": "SYNTH",
            "report_type": "financial_statements",
            "reporting_year": 2025,
            "metadata_origin": "user_supplied_or_unknown",
            "report_scope": null,
            "publication_date": null,
            "pdf_page_count": 1
          }
        ],
        "source_artifacts": [
          {
            "artifact_id": "artifact_b1207571d2bd648764f792f42ce63795e5f1af53f3708c063bc6241c66443cc0",
            "path": "source.pdf",
            "sha256": "fe772064cb167fc5676aa1668baaf89d430c395be6255493ce7484d15f0faf12",
            "kind": "pdf"
          },
          {
            "artifact_id": "artifact_7c697675daed6986e144be37b06db49c5430f2fc7f2a5ad3f1a7a0149f679574",
            "path": "pages/0001.json",
            "sha256": "8fdac2e9db8c3e1d5b218e0e5f2e55d5d8e8d6c2434a7d9005b3432bc6734c92",
            "kind": "page_checkpoint"
          }
        ],
        "source_blocks": [
          {
            "block_id": "anchor_cf660eec6e6aaffa6a117795a4c0e5b4a2fa125b01d56fbb6a7cc1de69e182df",
            "report_version_id": "report_fe772064cb167fc5676aa1668baaf89d430c395be6255493ce7484d15f0faf12",
            "kind": "texts",
            "label": "text",
            "original_text": "BÁO CÁO TÀI CHÍNH RIÊNG",
            "original_cells": null,
            "source": {
              "artifact_id": "artifact_7c697675daed6986e144be37b06db49c5430f2fc7f2a5ad3f1a7a0149f679574",
              "artifact_sha256": "8fdac2e9db8c3e1d5b218e0e5f2e55d5d8e8d6c2434a7d9005b3432bc6734c92",
              "native_json_pointer": "/document/texts/0",
              "pdf_page": 1,
              "printed_page": null,
              "native_provenance": []
            },
            "disposition": "pending_semantic_extraction"
          },
          {
            "block_id": "anchor_23232ffdf65fa3e4795eff7df18d4a93115414d9da49fda41ad9b94e7cc56919",
            "report_version_id": "report_fe772064cb167fc5676aa1668baaf89d430c395be6255493ce7484d15f0faf12",
            "kind": "texts",
            "label": "text",
            "original_text": "Đơn vị tính: VND",
            "original_cells": null,
            "source": {
              "artifact_id": "artifact_7c697675daed6986e144be37b06db49c5430f2fc7f2a5ad3f1a7a0149f679574",
              "artifact_sha256": "8fdac2e9db8c3e1d5b218e0e5f2e55d5d8e8d6c2434a7d9005b3432bc6734c92",
              "native_json_pointer": "/document/texts/1",
              "pdf_page": 1,
              "printed_page": null,
              "native_provenance": []
            },
            "disposition": "pending_semantic_extraction"
          },
          {
            "block_id": "anchor_b918fd5f14294f999b61e2044245dd09ea90cbdab4e3d34b92cd63d206126030",
            "report_version_id": "report_fe772064cb167fc5676aa1668baaf89d430c395be6255493ce7484d15f0faf12",
            "kind": "tables",
            "label": null,
            "original_text": null,
            "original_cells": [
              {
                "text": "Chỉ tiêu",
                "column_header": true,
                "start_row_offset_idx": 0,
                "end_row_offset_idx": 1,
                "start_col_offset_idx": 0,
                "end_col_offset_idx": 1
              },
              {
                "text": "Mã số",
                "column_header": true,
                "start_row_offset_idx": 0,
                "end_row_offset_idx": 1,
                "start_col_offset_idx": 1,
                "end_col_offset_idx": 2
              },
              {
                "text": "2025",
                "column_header": true,
                "start_row_offset_idx": 0,
                "end_row_offset_idx": 1,
                "start_col_offset_idx": 2,
                "end_col_offset_idx": 3
              },
              {
                "text": "2024",
                "column_header": true,
                "start_row_offset_idx": 0,
                "end_row_offset_idx": 1,
                "start_col_offset_idx": 3,
                "end_col_offset_idx": 4
              },
              {
                "text": "Doanh thu thuần",
                "column_header": false,
                "start_row_offset_idx": 1,
                "end_row_offset_idx": 2,
                "start_col_offset_idx": 0,
                "end_col_offset_idx": 1
              },
              {
                "text": "10",
                "column_header": false,
                "start_row_offset_idx": 1,
                "end_row_offset_idx": 2,
                "start_col_offset_idx": 1,
                "end_col_offset_idx": 2
              },
              {
                "text": "100",
                "column_header": false,
                "start_row_offset_idx": 1,
                "end_row_offset_idx": 2,
                "start_col_offset_idx": 2,
                "end_col_offset_idx": 3
              },
              {
                "text": "90",
                "column_header": false,
                "start_row_offset_idx": 1,
                "end_row_offset_idx": 2,
                "start_col_offset_idx": 3,
                "end_col_offset_idx": 4
              }
            ],
            "source": {
              "artifact_id": "artifact_7c697675daed6986e144be37b06db49c5430f2fc7f2a5ad3f1a7a0149f679574",
              "artifact_sha256": "8fdac2e9db8c3e1d5b218e0e5f2e55d5d8e8d6c2434a7d9005b3432bc6734c92",
              "native_json_pointer": "/document/tables/0",
              "pdf_page": 1,
              "printed_page": null,
              "native_provenance": []
            },
            "disposition": "pending_semantic_extraction"
          }
        ],
        "records": [
          {
            "record_id": "record_da7397298d2e9cad662d626d824941dc754db2426c0cd7f8115e8511dc13cbef",
            "report_version_id": "report_fe772064cb167fc5676aa1668baaf89d430c395be6255493ce7484d15f0faf12",
            "record_type": "metric",
            "company_id": "SYNTH",
            "reported_entity": null,
            "domain": "financial",
            "original_text": "Doanh thu thuần",
            "original_cells": [
              {
                "text": "Doanh thu thuần",
                "column_header": false,
                "start_row_offset_idx": 1,
                "end_row_offset_idx": 2,
                "start_col_offset_idx": 0,
                "end_col_offset_idx": 1
              },
              {
                "text": "10",
                "column_header": false,
                "start_row_offset_idx": 1,
                "end_row_offset_idx": 2,
                "start_col_offset_idx": 1,
                "end_col_offset_idx": 2
              },
              {
                "text": "100",
                "column_header": false,
                "start_row_offset_idx": 1,
                "end_row_offset_idx": 2,
                "start_col_offset_idx": 2,
                "end_col_offset_idx": 3
              },
              {
                "text": "90",
                "column_header": false,
                "start_row_offset_idx": 1,
                "end_row_offset_idx": 2,
                "start_col_offset_idx": 3,
                "end_col_offset_idx": 4
              }
            ],
            "source_refs": [
              "anchor_b918fd5f14294f999b61e2044245dd09ea90cbdab4e3d34b92cd63d206126030",
              "anchor_cf660eec6e6aaffa6a117795a4c0e5b4a2fa125b01d56fbb6a7cc1de69e182df"
            ],
            "interpretation_notes": [],
            "content_period": null,
            "classification": {
              "pillar": "unknown",
              "topic_candidates": []
            },
            "boundary": {
              "included_entities": null,
              "excluded_entities": null,
              "consolidation_method": null,
              "missing_fields": [
                "consolidation_method",
                "excluded_entities",
                "included_entities"
              ]
            },
            "payload": {
              "original_name": "Doanh thu thuần",
              "code_candidates": [],
              "definition": null,
              "methodology": null,
              "item_code_raw": "10",
              "row_group_raw": null,
              "statement_scope": "separate",
              "logical_table_id": "logical_table_f238dfd4fe6a327f1324a01bd2425f66b1ae027d00adfde87afd855539e1f902",
              "statement_type": "note_table",
              "table_title_raw": null,